{
  "run_id": "2026-10-07-wed",
  "round": 1,
  "locale": "sv",
  "topic_key": "inspiration-book-nook-idea",
  "pillar": "INSPIRATION",
  "title": "Book nook: en liten värld mellan böckerna i din bokhylla",
  "description": "Ett book nook är en liten scen mellan böckerna i hyllan som verkar djup och lyser inifrån. Vi förklarar var idén kommer ifrån, vad scenen består av och vad du bör fundera på inför ditt första hörn.",
  "seo_title": "Book nook: vad det är och hur du får ett i hyllan hemma",
  "seo_description": "Vad är ett book nook, var kommer idén ifrån, hur en liten scen mellan böcker ger djup och vad du bör fundera på först: plats, ljus och tid.",
  "slug": "book-nook-en-liten-varld-mellan-bockerna-i-din-bokhylla",
  "blocks": [
    {
      "id": "b01",
      "type": "image",
      "data": {
        "role": "cover",
        "caption": "Book nook: en liten värld mellan böckerna i din bokhylla"
      }
    },
    {
      "id": "b02",
      "type": "paragraph",
      "data": {
        "text": "Ett <strong>book nook</strong> är en liten scen som du skjuter in mellan böckerna i hyllan så att den ser ut som ett fönster mot en annan värld: mot en nattlig gränd, en bokhandel eller en förtrollad liten butik. Du kan ha ett hemma också, eftersom det bara tar upp en smal lucka i bokraden. Du kan bygga ihop det av en byggsats eller hitta på det från grunden."
      }
    },
    {
      "id": "b03",
      "type": "paragraph",
      "data": {
        "text": "Vi förklarar för dig var idén kommer ifrån, varför en liten scen verkar djup, vilka motiv folk oftast bygger och vad du bör fundera på innan du börjar ditt första hörn: platsen i hyllan, strömförsörjningen till ljuset och tiden."
      }
    },
    {
      "id": "b04",
      "type": "HTML",
      "data": {
        "code": "<div class=\"rt-toc\" style=\"margin:24px 0;padding:16px 20px;background:#fff8e1;border-left:4px solid #f5a623;border-radius:8px;\">\n  <p style=\"margin:0 0 8px;\"><strong>Artikelns innehåll</strong></p>\n  <ol style=\"margin:0;padding-left:20px;\">\n    <li style=\"margin:0 0 8px;\"><a href=\"#s1\">Vad ett book nook är och var det kommer ifrån</a></li>\n    <li style=\"margin:0 0 8px;\"><a href=\"#s2\">Så ger en liten scen intryck av djup</a></li>\n    <li style=\"margin:0 0 8px;\"><a href=\"#s3\">Vilka motiv folk bygger</a></li>\n    <li style=\"margin:0 0 8px;\"><a href=\"#s4\">Vad du bör fundera på före ditt första hörn</a></li>\n    <li style=\"margin:0 0 8px;\"><a href=\"#s5\">Byggsatser till ditt första book nook</a></li>\n    <li style=\"margin:0 0 8px;\"><a href=\"#s6\">Vanliga frågor</a></li>\n  </ol>\n</div>",
        "style": "",
        "localization": {}
      }
    },
    {
      "id": "b05",
      "type": "header",
      "data": {
        "text": "Vad ett book nook är och var det kommer ifrån",
        "level": 2,
        "elementID": "s1"
      }
    },
    {
      "id": "b06",
      "type": "paragraph",
      "data": {
        "text": "Ett book nook, på svenska bokhörna eller hyllinsats, är en <em>diorama</em>, alltså en tredimensionell miniatyrscen i en smal låda som du tittar på framifrån som genom ett fönster. Det är utformat för att få plats mellan böcker. Det liknar ett bokstöd, fast det står mitt i raden och inte i änden av den."
      }
    },
    {
      "id": "b07",
      "type": "paragraph",
      "data": {
        "text": "Enligt tillgängliga källor spreds formen omkring 2018, när en japansk formgivare gjorde träinsatser som visade Tokyos bakgator och passade mellan pocketböcker. Fotona spreds snabbt i sociala medier, framför allt på Reddit, där det också bildades en egen gemenskap. Andra skapare började bygga egna versioner, ofta efter kända böcker, till exempel som en gata ur en fantasyroman."
      }
    },
    {
      "id": "b08",
      "type": "paragraph",
      "data": {
        "text": "I dag går de att köpa färdiga eller bygga ihop av en byggsats. De görs också av material som ofta finns hemma: kartong, tjock kartong eller styvt papper. Scenen behöver inte stå mellan böcker: den kan också byggas som en fristående lådscen i hyllan."
      }
    },
    {
      "id": "b09",
      "type": "header",
      "data": {
        "text": "Så ger en liten scen intryck av djup",
        "level": 2,
        "elementID": "s2"
      }
    },
    {
      "id": "b10",
      "type": "paragraph",
      "data": {
        "text": "Scenen är oftast bara några centimeter djup, och ändå ser den ut som en gata som försvinner i fjärran. Intrycket uppstår av flera saker på en gång."
      }
    },
    {
      "id": "b11",
      "type": "list",
      "data": {
        "style": "unordered",
        "items": [
          {
            "content": "<strong>Perspektiv.</strong> Perspektiv är att saker blir mindre med avståndet från ögat. Husen längst bak är därför lägre och har färre detaljer än de längst fram, fast scenen i verkligheten är kort.",
            "items": []
          },
          {
            "content": "<strong>Ljus.</strong> Ett mörkt hörn antyder rymd och ett upplyst fönster antyder ett rum bakom det. Man använder små LED-lampor (en LED är en liten lysdiod) som får plats på trånga ställen, oftast i varmvitt eller bärnsten.",
            "items": []
          },
          {
            "content": "<strong>Spegel bakom.</strong> Vissa skapare sätter en vanlig spegel på bakväggen och framför scenen, på visst avstånd från den, en halvgenomskinlig (enkelriktad) spegel som man ser in genom. Speglarna speglar varandra, och då ser scenen ut som en oändlig väg. Sätt inte den halvgenomskinliga spegeln helt längst fram, för då skulle den spegla ljuset från rummet.",
            "items": []
          },
          {
            "content": "<strong>Skala.</strong> Skala är förhållandet mellan verklig och förminskad storlek. Föremål på samma avstånd ska ha samma skala, annars slutar scenen vara trovärdig. Om du lägger till ett eget föremål, håll det först mot de färdiga delarna och jämför.",
            "items": []
          }
        ]
      }
    },
    {
      "id": "b12",
      "type": "paragraph",
      "data": {
        "text": "Därför lönar det sig att först fundera på ljus och skala och först sedan lägga till småsaker. Om hur du ändrar stämningen i en färdig scen med ljus skriver vi också i <a href=\"/blogg/halloween-pa-hyllan-sa-dekorerar-du-ett-fardigt-miniatyrhus\">artikeln om halloweendekoration till ett miniatyrhus</a>."
      }
    },
    {
      "id": "b13",
      "type": "header",
      "data": {
        "text": "Vilka motiv folk bygger",
        "level": 2,
        "elementID": "s3"
      }
    },
    {
      "id": "b14",
      "type": "paragraph",
      "data": {
        "text": "Motiven varierar. Dessa förekommer ofta i källorna och kan byggas både av en byggsats och av kartong."
      }
    },
    {
      "id": "b15",
      "type": "HTML",
      "data": {
        "code": "<div style=\"overflow-x:auto\"><table><thead><tr><th>Motiv</th><th>Vad scenen visar</th><th>Vad som gör den trovärdig</th></tr></thead><tbody><tr><td>Nattlig gränd</td><td>en smal väg mellan hus med upplysta fönster</td><td>husen längst bak är lägre och ljuset i fönstren antyder rum</td></tr><tr><td>Bokhandel eller bibliotek</td><td>hyllor, en soffa och bord fulla av pyttesmå böcker</td><td>detaljer av papper och trähyllor i samma skala</td></tr><tr><td>Café eller tehus</td><td>ett skyltfönster, små bord och lyktor vid ingången</td><td>varmt ljus vid ingången och ett mörkare hörn längst bak</td></tr><tr><td>Fantasybutik</td><td>en trollkarlsverkstad, ett värdshus eller en hemlig dörr</td><td>små rekvisita och ovanliga färger</td></tr><tr><td>Skog eller trädgård</td><td>träd, en stig och små djur</td><td>en stig som försvinner i fjärran, eventuellt en spegel bakom</td></tr></tbody></table></div>",
        "style": "",
        "localization": {}
      }
    },
    {
      "id": "b16",
      "type": "paragraph",
      "data": {
        "text": "Om du inte vet vad du ska välja, utgå från en bok du verkligen gillar eller en plats du skulle vilja besöka. Ett motiv du tycker om hjälper dig att hålla ut även vid små detaljer."
      }
    },
    {
      "id": "b17",
      "type": "header",
      "data": {
        "text": "Vad du bör fundera på före ditt första hörn",
        "level": 2,
        "elementID": "s4"
      }
    },
    {
      "id": "b18",
      "type": "paragraph",
      "data": {
        "text": "Innan du börjar bygga eller beställa något, gå igenom de här punkterna."
      }
    },
    {
      "id": "b19",
      "type": "list",
      "data": {
        "style": "ordered",
        "items": [
          {
            "content": "<strong>Plats i hyllan.</strong> Mät bredden på luckan, hyllplanets höjd och dess djup och jämför med scenens mått i byggsatsens beskrivning eller i ritningen. Scenen skjuts in mellan böckerna, så låt dem stå på båda sidor så att de håller den stadigt.",
            "items": []
          },
          {
            "content": "<strong>Strömförsörjning till ljuset.</strong> Ljuset går oftast på batterier eller får ström via en sladd. Ta reda på var batterifacket eller sladden kommer att sitta och om du kommer åt dem när scenen står mellan böckerna.",
            "items": []
          },
          {
            "content": "<strong>Tid.</strong> Beroende på svårighetsgrad tar bygget från några timmar till några kvällar. Uppgiften för en viss byggsats hittar du i dess beskrivning.",
            "items": []
          },
          {
            "content": "<strong>Verktyg.</strong> Vid eget bygge av kartong behöver du en vass kniv och ett underlag. Verktygen finns i <a href=\"/blogg/10-verktyg-du-behover-nar-du-satter-ihop-ett-3d-pussel-i-tra\">artikeln om verktyg för bygget</a>. Upphovspersonen till ett av tillvägagångssätten med tjock kartong limmar delarna med en limpistol (ett verktyg som smälter en limstav) och skyddar fingrarna med särskilda fingerskydd.",
            "items": []
          },
          {